{
  "$schema": "https://json-schema.org/draft/2020-12/schema",
  "$id": "https://github.com/inem/tap-core/contracts/page-resource/v1/schema.json",
  "title": "TAP page resource provider v1",
  "type": "object",
  "additionalProperties": false,
  "required": [
    "contract",
    "id",
    "version",
    "kind",
    "file",
    "sha256",
    "license",
    "source_revision"
  ],
  "properties": {
    "contract": {"const": "tap.page-resource/v1"},
    "id": {"type": "string", "pattern": "^[a-z][a-z0-9]*(?:[.-][a-z0-9]+)*$"},
    "version": {"type": "string", "pattern": "^(?:0|[1-9][0-9]*)\\.(?:0|[1-9][0-9]*)\\.(?:0|[1-9][0-9]*)$"},
    "kind": {"const": "browser-classic-script"},
    "file": {"type": "string", "minLength": 1},
    "sha256": {"type": "string", "pattern": "^[0-9a-f]{64}$"},
    "license": {"type": "string", "minLength": 1},
    "source_revision": {"type": "string", "minLength": 1}
  }
}
